{
  "base_sha": "3998c4c774944baec9151111cc3f628b06fde029",
  "blockers": [],
  "candidate_ref": "refs/heads/icm/candidates/command-center-draco-fix-001",
  "candidate_sha": "b5e27e729e6481bc98875177057fc0a193aef7ce",
  "changed_paths": [
    "docs/portfolio-world/evidence/command-center-draco-fix-001/correction.md",
    "public/draco/README.md",
    "public/draco/draco_decoder.js",
    "src/world/art/CommandCenterArt.tsx",
    "tests/command-center-runtime.test.ts"
  ],
  "claim_ref": "refs/heads/icm/claims/command-center-draco-fix-001",
  "execution": {
    "branch": "icm/run/command-center-draco-fix-001",
    "worktree_id": "command-center-draco-fix-001"
  },
  "executor_identity": "local/workstation:executor/luna",
  "next_action": "await_review",
  "protected_state": "unchanged",
  "record_type": "result",
  "repository": "element-bendr/my-resume-site",
  "schema_version": 1,
  "stage_id": "02-command-center-integration",
  "status": "pass",
  "task_id": "command-center-draco-fix-001",
  "validation": [
    {
      "id": "command-center-draco-local",
      "status": "pass",
      "summary": "exit=0"
    },
    {
      "id": "blender-assets",
      "status": "pass",
      "summary": "exit=0"
    },
    {
      "id": "runtime-integration",
      "status": "pass",
      "summary": "exit=0"
    },
    {
      "id": "icm-stage",
      "status": "pass",
      "summary": "exit=0"
    }
  ],
  "workflow_id": "portfolio-world-blender-art"
}
