{
  "base_sha": "890f584306b6a44c4bf5d325591cb7e9ee1bf718",
  "blockers": [],
  "candidate_ref": "refs/heads/icm/candidates/command-center-runtime-001",
  "candidate_sha": "d29071a4c0d5013f35e2baef890efc4ab8da3071",
  "changed_paths": [
    "docs/portfolio-world/COMMAND-CENTER-RUNTIME-INTEGRATION.md",
    "src/world/CommandCenter.tsx",
    "src/world/art/CommandCenterArt.tsx",
    "tests/command-center-runtime.test.ts"
  ],
  "claim_ref": "refs/heads/icm/claims/command-center-runtime-001",
  "execution": {
    "branch": "icm/run/command-center-runtime-001",
    "worktree_id": "command-center-runtime-001"
  },
  "executor_identity": "local/workstation:executor/luna",
  "next_action": "await_review",
  "protected_state": "unchanged",
  "record_type": "result",
  "repository": "element-bendr/my-resume-site",
  "schema_version": 1,
  "stage_id": "02-command-center-integration",
  "status": "pass",
  "task_id": "command-center-runtime-001",
  "validation": [
    {
      "id": "blender-assets",
      "status": "pass",
      "summary": "exit=0"
    },
    {
      "id": "runtime-integration",
      "status": "pass",
      "summary": "exit=0"
    },
    {
      "id": "icm-stage",
      "status": "pass",
      "summary": "exit=0"
    }
  ],
  "workflow_id": "portfolio-world-blender-art"
}
